id,title,score,num_comments,author,created_utc,url,over_18,edited,spoiler,stickied
1e3d33i,What does great data Engineering mentorship look like?,53,8,pipeline_wizard,2024-07-14 21:16:53,https://www.reddit.com/r/dataengineering/comments/1e3d33i/what_does_great_data_engineering_mentorship_look/,False,False,False,False
1e3kaai,"I have an MS in Data Science. Should I get a second MS in Software Engineering, PhD, or Some Certs (it’s free from employer)?",39,60,ParticularBattle2713,2024-07-15 02:53:24,https://www.reddit.com/r/dataengineering/comments/1e3kaai/i_have_an_ms_in_data_science_should_i_get_a/,False,False,False,False
1e3n522,Economical data warehouse based on Parquet in GCP Storage,31,23,GreymanTheGrey,2024-07-15 05:40:00,https://www.reddit.com/r/dataengineering/comments/1e3n522/economical_data_warehouse_based_on_parquet_in_gcp/,False,False,False,False
1e3y2re,Your dream data Architecture,31,30,bancaletto,2024-07-15 15:46:01,https://www.reddit.com/r/dataengineering/comments/1e3y2re/your_dream_data_architecture/,False,False,False,False
1e3j0k8,Crash course in Kimball Data Modeling ,21,2,nydasco,2024-07-15 01:48:26,https://www.reddit.com/r/dataengineering/comments/1e3j0k8/crash_course_in_kimball_data_modeling/,False,False,False,False
1e3mw63,Building a real-time personalization engine,12,0,ephemeral404,2024-07-15 05:24:48,https://i.redd.it/m1fphhfabmcd1.png,False,False,False,False
1e3i04w,Alternative to dbt metrics,10,5,Toby1knoby20,2024-07-15 00:57:15,https://www.reddit.com/r/dataengineering/comments/1e3i04w/alternative_to_dbt_metrics/,False,False,False,False
1e3u406,Cloud warehouse bills,11,7,Front_Veterinarian53,2024-07-15 12:56:01,https://www.reddit.com/r/dataengineering/comments/1e3u406/cloud_warehouse_bills/,False,False,False,False
1e3nt51,Would you use a Data Engineer focused CoPilot?,9,33,Bright_Bunch_7208,2024-07-15 06:22:43,https://www.reddit.com/r/dataengineering/comments/1e3nt51/would_you_use_a_data_engineer_focused_copilot/,False,False,False,False
1e3bkpk,Bridgetable or Array to model M:M relation database,5,5,Material-Mess-9886,2024-07-14 20:06:56,https://www.reddit.com/r/dataengineering/comments/1e3bkpk/bridgetable_or_array_to_model_mm_relation_database/,False,False,False,False
1e42iqn,Free Sample Data Generator,6,2,ExploAnalytics,2024-07-15 18:41:07,https://www.reddit.com/r/dataengineering/comments/1e42iqn/free_sample_data_generator/,False,False,False,False
1e415ze,New to databricks and snowflakes,4,3,Far-Mixture-2254,2024-07-15 17:47:21,https://www.reddit.com/r/dataengineering/comments/1e415ze/new_to_databricks_and_snowflakes/,False,False,False,False
1e3aega,Currently onboarding a third party to work on our data migration - any security protocol / best practices when doing this?,4,3,Ok_Huckleberry6185,2024-07-14 19:14:00,https://www.reddit.com/r/dataengineering/comments/1e3aega/currently_onboarding_a_third_party_to_work_on_our/,False,False,False,False
1e3uc5v,Tearing Down the Monolith | The Rise of Microservices & Modular Architecture in Data Engineering,4,1,growth_man,2024-07-15 13:06:38,https://moderndata101.substack.com/p/tearing-down-monolith-the-rise-of-microservices,False,False,False,False
1e3q21m,Designing Platform Logging Pipeline,4,4,DifficultyNo3182,2024-07-15 08:55:22,https://www.reddit.com/r/dataengineering/comments/1e3q21m/designing_platform_logging_pipeline/,False,False,False,False
1e3bywj,Suggestion on Dimensional modeling Aggregations,5,0,CaptainMalikk,2024-07-14 20:29:09,https://www.reddit.com/r/dataengineering/comments/1e3bywj/suggestion_on_dimensional_modeling_aggregations/,False,False,False,False
1e3a95c,VSCode Navigator for Apache Pinot,5,0,hkdelay,2024-07-14 19:07:24,https://marketplace.visualstudio.com/items?itemName=1Schema.pinotdb,False,False,False,False
1e3qc87,Glue Visual Studio Help,3,2,Free-Way-5831,2024-07-15 09:14:19,https://www.reddit.com/r/dataengineering/comments/1e3qc87/glue_visual_studio_help/,False,False,False,False
1e430af,MySQL-to-Snowflake and PostgreSQL-to-Snowflake native connectors!,1,0,feelosophy13,2024-07-15 19:00:34,https://www.reddit.com/r/dataengineering/comments/1e430af/mysqltosnowflake_and_postgresqltosnowflake_native/,False,False,False,False
1e420vl,Stuck with legacy data tech,1,2,photon223,2024-07-15 18:21:30,https://www.reddit.com/r/dataengineering/comments/1e420vl/stuck_with_legacy_data_tech/,False,False,False,False
1e3wlbk,Python UDFs in Snowflake,1,0,Datafluent,2024-07-15 14:46:22,https://www.reddit.com/r/dataengineering/comments/1e3wlbk/python_udfs_in_snowflake/,False,False,False,False
1e42o3l,Real time Monitoring dashboard 🚀,0,1,Far-Mixture-2254,2024-07-15 18:47:02,https://www.reddit.com/r/dataengineering/comments/1e42o3l/real_time_monitoring_dashboard/,False,False,False,False
1e3wz5i,Top 5 Airflow Alternatives for Data Orchestration (Code Examples Included),0,1,kingabzpro,2024-07-15 15:02:02,https://www.datacamp.com/blog/airflow-alternatives,False,False,False,False
1e3walc,Would it make sense to use these tools in this context? ,0,5,LlosgiTaiBraf,2024-07-15 14:33:35,https://www.reddit.com/r/dataengineering/comments/1e3walc/would_it_make_sense_to_use_these_tools_in_this/,False,False,False,False
1e3exzs,Data Project,0,4,LostVisionary,2024-07-14 22:34:35,https://www.reddit.com/r/dataengineering/comments/1e3exzs/data_project/,False,False,False,False
